{
  "channel": "<channel>",
  "checkpoint": {
    "exists": true,
    "last_entry_hash": "sha256:<hash>",
    "log_bytes": 0,
    "reason": null,
    "records": 4,
    "valid": true
  },
  "command": "start",
  "context": {
    "brief": {
      "active_blockers": [],
      "active_claims": [],
      "active_tasks": [],
      "artifacts": [
        {
          "artifact_kind": "review-notes",
          "event_id": "evt_1",
          "origin": "local",
          "ref_task_id": null,
          "subject": "packet implementation notes",
          "summary": null,
          "uri": "crates/rally-core/src/context.rs"
        }
      ],
      "attuned_items": [
        {
          "event_id": "evt_1",
          "factors": [
            "artifact:review-notes",
            "local"
          ],
          "kind": "artifact",
          "origin": "local",
          "paths": [
            "crates/rally-core/src/context.rs"
          ],
          "score": 43,
          "source_event_ids": [
            "evt_1"
          ],
          "subject": "packet implementation notes"
        },
        {
          "event_id": "evt_2",
          "factors": [
            "lesson:coordination",
            "local"
          ],
          "kind": "lesson",
          "origin": "local",
          "score": 41,
          "source_event_ids": [
            "evt_2"
          ],
          "subject": "packets preserve source-linked context"
        },
        {
          "event_id": "evt_3",
          "factors": [
            "decision:binding",
            "local"
          ],
          "kind": "decision",
          "origin": "local",
          "paths": [
            "crates/rally-core/src/context.rs"
          ],
          "score": 38,
          "source_event_ids": [
            "evt_3"
          ],
          "subject": "packets are read-only derived state"
        },
        {
          "event_id": "evt_4",
          "factors": [
            "recent_change",
            "local",
            "fresh"
          ],
          "kind": "recent_profile",
          "origin": "local",
          "score": 31,
          "source_event_ids": [
            "evt_4"
          ],
          "subject": "profile codex-reviewer"
        }
      ],
      "collision_risk": [],
      "decisions": [
        {
          "event_id": "evt_3",
          "origin": "local",
          "rationale": null,
          "scope": "crates/rally-core/src/context.rs",
          "status": "binding",
          "subject": "packets are read-only derived state",
          "supersedes": []
        }
      ],
      "lessons": [
        {
          "confidence": 0.8,
          "event_id": "evt_2",
          "lesson_kind": "coordination",
          "origin": "local",
          "scope": null,
          "source_event_ids": [],
          "subject": "packets preserve source-linked context"
        }
      ],
      "needs_attention": [],
      "profile": null,
      "recommended_next_action": {
        "action": "proceed_solo",
        "confidence": 0.55,
        "minimum_trust_for_automation": "none",
        "reason": "no pending handoffs, blockers, or claim conflicts for this tool",
        "source_event_ids": [],
        "trust": {
          "automation_allowed": true,
          "required": "none",
          "source_statuses": []
        }
      },
      "relevant_changes": [
        {
          "age_seconds": 0,
          "event_id": "evt_4",
          "kind": "profile",
          "origin": "local",
          "subject": "profile codex-reviewer",
          "thread_id": "thr_1",
          "tool": "codex-reviewer"
        },
        {
          "age_seconds": 0,
          "event_id": "evt_1",
          "kind": "artifact",
          "origin": "local",
          "subject": "packet implementation notes",
          "thread_id": "thr_2",
          "tool": "codex"
        },
        {
          "age_seconds": 0,
          "event_id": "evt_3",
          "kind": "decision",
          "origin": "local",
          "subject": "packets are read-only derived state",
          "thread_id": "thr_3",
          "tool": "codex"
        },
        {
          "age_seconds": 0,
          "event_id": "evt_2",
          "kind": "lesson",
          "origin": "local",
          "subject": "packets preserve source-linked context",
          "thread_id": "thr_4",
          "tool": "codex"
        }
      ],
      "routing": {
        "action": "proceed_solo",
        "reason": "no pending handoffs, blockers, or claim conflicts for this tool"
      },
      "subscription": null,
      "tool": "pi",
      "top_priority": null
    }
  },
  "cursor": {
    "advanced": true,
    "after": 4,
    "before": 0,
    "max_seq": 4,
    "unseen_count": 4
  },
  "next_commands": {
    "context": "rally context --tool pi --json",
    "packet": "rally packet --tool pi --json",
    "watch": "rally watch --tool pi --session-id pi-golden --since-cursor"
  },
  "ok": true,
  "packet": {
    "files": [
      "crates/rally-core/src/context.rs"
    ],
    "focus": [
      {
        "event_id": "evt_1",
        "factors": [
          "artifact:review-notes",
          "local"
        ],
        "kind": "artifact",
        "origin": "local",
        "paths": [
          "crates/rally-core/src/context.rs"
        ],
        "score": 43,
        "source_event_ids": [
          "evt_1"
        ],
        "subject": "packet implementation notes"
      },
      {
        "event_id": "evt_2",
        "factors": [
          "lesson:coordination",
          "local"
        ],
        "kind": "lesson",
        "origin": "local",
        "score": 41,
        "source_event_ids": [
          "evt_2"
        ],
        "subject": "packets preserve source-linked context"
      },
      {
        "event_id": "evt_3",
        "factors": [
          "decision:binding",
          "local"
        ],
        "kind": "decision",
        "origin": "local",
        "paths": [
          "crates/rally-core/src/context.rs"
        ],
        "score": 38,
        "source_event_ids": [
          "evt_3"
        ],
        "subject": "packets are read-only derived state"
      },
      {
        "event_id": "evt_4",
        "factors": [
          "recent_change",
          "local",
          "fresh"
        ],
        "kind": "recent_profile",
        "origin": "local",
        "score": 31,
        "source_event_ids": [
          "evt_4"
        ],
        "subject": "profile codex-reviewer"
      }
    ],
    "packet_kind": "general",
    "profile": null,
    "recommended_next_action": {
      "action": "proceed_solo",
      "confidence": 0.55,
      "minimum_trust_for_automation": "none",
      "reason": "no pending handoffs, blockers, or claim conflicts for this tool",
      "source_event_ids": [],
      "trust": {
        "automation_allowed": true,
        "required": "none",
        "source_statuses": []
      }
    },
    "role": "general",
    "source_event_ids": [
      "evt_1",
      "evt_2",
      "evt_3",
      "evt_4"
    ],
    "tool": "pi",
    "trust_summary": {
      "invalid": 0,
      "local": 4,
      "minimum_trust_for_automation": "none",
      "recommendation_automation_allowed": true,
      "trusted": 0,
      "unknown": 0,
      "unsigned": 0,
      "untrusted": 0
    }
  },
  "preflight": {
    "active_blockers": [],
    "active_claims": [],
    "active_peers": [],
    "channel": "<channel>",
    "claim_conflicts": [],
    "command": "preflight",
    "coordination_status": "idle",
    "ok": true,
    "pending_acks_for_me": [],
    "presence_written": "<presence_written>",
    "recent_changes": [
      {
        "age_seconds": 0,
        "event_id": "evt_4",
        "kind": "profile",
        "origin": "local",
        "subject": "profile codex-reviewer",
        "thread_id": "thr_1",
        "tool": "codex-reviewer"
      },
      {
        "age_seconds": 0,
        "event_id": "evt_1",
        "kind": "artifact",
        "origin": "local",
        "subject": "packet implementation notes",
        "thread_id": "thr_2",
        "tool": "codex"
      },
      {
        "age_seconds": 0,
        "event_id": "evt_3",
        "kind": "decision",
        "origin": "local",
        "subject": "packets are read-only derived state",
        "thread_id": "thr_3",
        "tool": "codex"
      },
      {
        "age_seconds": 0,
        "event_id": "evt_2",
        "kind": "lesson",
        "origin": "local",
        "subject": "packets preserve source-linked context",
        "thread_id": "thr_4",
        "tool": "codex"
      }
    ],
    "routing": {
      "action": "proceed_solo",
      "reason": "no pending acknowledgements or active peers"
    },
    "schema": "agent-rally.command.preflight.v1",
    "session_id": "pi-golden",
    "tool": "pi"
  },
  "schema": "agent-rally.command.start.v1",
  "session_id": "pi-golden",
  "started_process": false,
  "tool": "pi",
  "warnings": []
}
